{
  "$schema": "http://json-schema.org/draft-07/schema#",
  "type": "object",
  "additionalProperties": false,
  "properties": {
    "risk_map": {
      "type": "object",
      "properties": {
        "critical": { "type": "array", "items": { "type": "string" } },
        "high": { "type": "array", "items": { "type": "string" } }
      },
      "additionalProperties": false
    },
    "mandatory_checks": { "type": "array", "items": { "type": "string" } },
    "project_rules": { "type": "array", "items": { "type": "string" } },
    "review_instructions": { "type": "string" },
    "always_dims": {
      "type": "array",
      "items": { "type": "string" },
      "description": "Dimensions (Dn ids) reviewed on every run regardless of tier — e.g. 'D16' simplification, a taste pass trimmed to opt-in below the high tier. Unknown ids are ignored. Persistent equivalent of passing them via --dimensions."
    },
    "models": {
      "type": "object",
      "description": "Per-dimension reviewer model selection (model = f(dimension, tier)). opus is reserved for opus_dims and only from opus_min_tier up; below that tier they use the base model. risk_map floors (via the raised tier) and an irreversible migration (D6 → opus) still apply on top.",
      "properties": {
        "by_tier": {
          "type": "object",
          "description": "Base reviewer model per tier (default: haiku for trivial, sonnet otherwise). Keys: trivial/low/standard/high/critical → a model name.",
          "properties": {
            "trivial": { "type": "string" },
            "low": { "type": "string" },
            "standard": { "type": "string" },
            "high": { "type": "string" },
            "critical": { "type": "string" }
          },
          "additionalProperties": false
        },
        "opus_dims": { "type": "array", "items": { "type": "string" }, "description": "Dimensions escalated to the strong model at opus_min_tier and above (default D3, D7, D9)." },
        "opus_min_tier": { "type": "string", "enum": ["trivial", "low", "standard", "high", "critical"], "description": "Lowest tier at which opus_dims run on the strong model (default 'high') — below it they use by_tier[tier]." }
      },
      "additionalProperties": false
    },
    "intent_sources": {
      "type": "object",
      "properties": {
        "pr": { "type": "boolean" },
        "commits": { "type": "boolean" },
        "pr_comments": { "type": "boolean" },
        "clickup": { "type": "boolean" },
        "jira": { "type": "boolean" }
      },
      "additionalProperties": false
    },
    "gate": {
      "type": "object",
      "properties": {
        "block_on": { "type": "array", "items": { "type": "string" } },
        "warn_on": { "type": "array", "items": { "type": "string" } }
      },
      "additionalProperties": false
    },
    "verify": {
      "type": "object",
      "description": "Bounded adversarial re-verification. Only low-confidence/uncertain aspects are re-checked; never the whole review.",
      "properties": {
        "max_passes_per_aspect": { "type": "integer", "minimum": 1, "maximum": 3, "description": "Total looks at one aspect incl. the original review (1 review + up to 2 verifier passes = 3)." },
        "max_subagents_per_aspect": { "type": "integer", "minimum": 1, "maximum": 3 },
        "reverify_below": { "type": "integer", "minimum": 0, "maximum": 100, "description": "Findings with confidence below this are sent to the verifier." },
        "report_confidence": { "type": "integer", "minimum": 0, "maximum": 100, "description": "Findings at/above this survive to the report." },
        "escalate_uncertain": { "type": "boolean", "description": "Still-uncertain after the cap → surface to the human, do not drop." },
        "model_first": { "type": "string", "description": "Model for the first (cheap) verifier pass. Default 'sonnet'." },
        "model_escalate": { "type": "string", "description": "Model the verifier escalates to on an uncertain or hot-refuted verdict, and runs directly for the severities in escalate_direct_severity. Its verdict is authoritative — the cheap one is discarded. Default 'opus'." },
        "escalate_direct_severity": { "type": "array", "items": { "type": "string", "enum": ["critical", "important", "minor", "suggestion"] }, "description": "Severities that skip the cheap pass and go straight to model_escalate. Default ['critical']." },
        "by_tier": {
          "type": "object",
          "description": "Per-tier overrides of the verify keys above. A tier entry (trivial/low/standard/high/critical) overrides the flat keys for that resolved tier; the flat keys stay the base. reverify_below is clamped up to report_confidence per tier so a per-tier relaxation can lower both together (fewer verifier spawns) but never opens a [reverify_below, report_confidence) dead band. Defaults keep 80/80 on every tier, so worst-case rigor is unchanged unless a project opts in here.",
          "properties": {
            "trivial": { "$ref": "#/definitions/verifyTier" },
            "low": { "$ref": "#/definitions/verifyTier" },
            "standard": { "$ref": "#/definitions/verifyTier" },
            "high": { "$ref": "#/definitions/verifyTier" },
            "critical": { "$ref": "#/definitions/verifyTier" }
          },
          "additionalProperties": false
        }
      },
      "additionalProperties": false
    },
    "escalation": {
      "type": "object",
      "description": "Spawn-on-doubt: when a reviewer flags uncertain:true, fan a tiny panel (capped) at just that aspect.",
      "properties": {
        "max_subagents_per_aspect": { "type": "integer", "minimum": 1, "maximum": 3 }
      },
      "additionalProperties": false
    },
    "large_diff": {
      "type": "object",
      "properties": {
        "shard_threshold_loc": { "type": "integer", "minimum": 1 },
        "max_shards": { "type": "integer", "minimum": 1, "maximum": 12 }
      },
      "additionalProperties": false
    },
    "diff_scope": {
      "type": "object",
      "description": "Diff-scope demotion: a finding anchored more than `slack` lines outside the changed hunks (on a changed file) is demoted to an advisory 'Out-of-scope observations' section — excluded from the verdict, gate, and --comment. Findings on unchanged files are always demoted; line-less findings on changed files are never demoted.",
      "properties": {
        "slack": { "type": "integer", "minimum": 0, "description": "Lines of tolerance above/below a hunk before a finding is treated as out-of-diff (default 3)." }
      },
      "additionalProperties": false
    },
    "scan": {
      "type": "object",
      "description": "Run real tools when available (advisory; findings feed D15).",
      "properties": {
        "deps": { "type": "boolean" },
        "tests": { "type": "boolean" },
        "lint": { "type": "boolean" }
      },
      "additionalProperties": false
    },
    "tests": {
      "type": "object",
      "description": "Test-execution signal (S6.4). With `/review --run-tests` the plugin runs `command` after checkout and feeds pass/fail + failing test NAMES (never logs) to the test-adequacy-reviewer (D5) and the report header. The command is NEVER guessed — it runs only when set here. It EXECUTES repo code; do not use --run-tests on an untrusted PR. Off by default (no --run-tests flag).",
      "properties": {
        "command": { "type": "string", "description": "The project's own test command, e.g. 'npm test' or 'pytest -q'." },
        "timeout_ms": { "type": "integer", "minimum": 1000, "description": "Kill the test command after this many ms (default 600000)." }
      },
      "additionalProperties": false
    },
    "completeness": {
      "type": "object",
      "description": "High-tier completeness SCREEN (S6.1): a cheap haiku false-negative screen that flags dimension/criterion COVERAGE gaps (it sees no diff, so not taint). Runs on the high tier only, and only when the full exhaustive critic is not already running.",
      "properties": {
        "screen_on_high": { "type": "boolean", "description": "Run the high-tier completeness screen (default true). Set false to skip the extra haiku pass." }
      },
      "additionalProperties": false
    },
    "checkout": {
      "type": "object",
      "description": "Detach HEAD onto the remote's latest pushed head for the review (restored afterwards), so the reviewers see the most recent pushed code rather than the local checkout. The reviewed diff is the GitHub-exact fork-point (three-dot) range by default. Disable to review the working tree in place.",
      "properties": {
        "enabled": { "type": "boolean" },
        "remote": { "type": "string" },
        "fork_point": { "type": "boolean", "description": "Review the GitHub-exact three-dot range merge-base(base,head)..head (default true). Set false to review the two-dot base..head instead (includes base's newer commits when the branch is behind)." }
      },
      "additionalProperties": false
    },
    "learning": {
      "type": "object",
      "description": "Per-project memory: recurring findings, accepted false-positives, and unresolved questions persist across runs.",
      "properties": {
        "enabled": { "type": "boolean" },
        "store": { "type": "string" }
      },
      "additionalProperties": false
    },
    "notify": {
      "type": "object",
      "properties": {
        "ask_on_unresolved": { "type": "boolean", "description": "Surface unresolved/assumption questions to the user instead of silently assuming." }
      },
      "additionalProperties": false
    },
    "trackers": {
      "type": "object",
      "description": "Issue-tracker key patterns. Tickets are fetched via MCP by the orchestrator — no API tokens are stored or used.",
      "properties": {
        "clickup": {
          "type": "object",
          "properties": {
            "key_pattern": { "type": "string" }
          },
          "additionalProperties": false
        },
        "jira": {
          "type": "object",
          "properties": {
            "key_pattern": { "type": "string" }
          },
          "additionalProperties": false
        }
      },
      "additionalProperties": false
    },
    "exhaustive": {
      "type": "object",
      "description": "Tier C ultrareview-parity passes (completeness critic, D3 taint verifier, and a double run of the correctness + vuln reviewers unioned by finding). Auto-on at the critical tier or with --exhaustive; they cost extra tokens.",
      "properties": {
        "on_critical": { "type": "boolean", "description": "Run the exhaustive passes automatically when the tier is critical (default true)." }
      },
      "additionalProperties": false
    },
    "usage": {
      "type": "object",
      "description": "Token-usage + USD-cost panel shown top-left of review.html. Summed from this run's session transcripts within the review window.",
      "properties": {
        "enabled": { "type": "boolean", "description": "Show the usage panel (default true). Set false to omit it." },
        "pricing": {
          "type": "object",
          "description": "Override the per-model-family price table (USD per million tokens). Each family overlays the defaults field-by-field; omit a field to keep the default.",
          "properties": {
            "opus": { "$ref": "#/definitions/familyPrice" },
            "sonnet": { "$ref": "#/definitions/familyPrice" },
            "haiku": { "$ref": "#/definitions/familyPrice" },
            "fable": { "$ref": "#/definitions/familyPrice" }
          },
          "additionalProperties": false
        }
      },
      "additionalProperties": false
    },
    "knowledge_packs": { "type": "object" }
  },
  "definitions": {
    "verifyTier": {
      "type": "object",
      "description": "Per-tier subset of the verify keys. Only the keys set here override the flat verify policy for that tier.",
      "properties": {
        "max_passes_per_aspect": { "type": "integer", "minimum": 1, "maximum": 3 },
        "max_subagents_per_aspect": { "type": "integer", "minimum": 1, "maximum": 3 },
        "reverify_below": { "type": "integer", "minimum": 0, "maximum": 100 },
        "report_confidence": { "type": "integer", "minimum": 0, "maximum": 100 },
        "escalate_uncertain": { "type": "boolean" },
        "model_first": { "type": "string" },
        "model_escalate": { "type": "string" },
        "escalate_direct_severity": { "type": "array", "items": { "type": "string", "enum": ["critical", "important", "minor", "suggestion"] } }
      },
      "additionalProperties": false
    },
    "familyPrice": {
      "type": "object",
      "properties": {
        "input": { "type": "number", "minimum": 0 },
        "output": { "type": "number", "minimum": 0 },
        "cacheWrite5m": { "type": "number", "minimum": 0 },
        "cacheWrite1h": { "type": "number", "minimum": 0 },
        "cacheRead": { "type": "number", "minimum": 0 }
      },
      "additionalProperties": false
    }
  }
}
